{
  "window_id": "childes_adam0915_target_0048_0087",
  "speakers": [
    {
      "pred_speaker_id": "FAT",
      "role": "father"
    },
    {
      "pred_speaker_id": "MOT",
      "role": "mother"
    },
    {
      "pred_speaker_id": "CHI",
      "role": "child"
    }
  ],
  "utterance_speaker_assignments": [
    {
      "utt_index": 0,
      "pred_speaker_id": "FAT"
    },
    {
      "utt_index": 1,
      "pred_speaker_id": "MOT"
    },
    {
      "utt_index": 2,
      "pred_speaker_id": "FAT"
    },
    {
      "utt_index": 3,
      "pred_speaker_id": "MOT"
    },
    {
      "utt_index": 4,
      "pred_speaker_id": "MOT"
    },
    {
      "utt_index": 5,
      "pred_speaker_id": "MOT"
    },
    {
      "utt_index": 6,
      "pred_speaker_id": "MOT"
    },
    {
      "utt_index": 7,
      "pred_speaker_id": "MOT"
    },
    {
      "utt_index": 8,
      "pred_speaker_id": "MOT"
    },
    {
      "utt_index": 9,
      "pred_speaker_id": "MOT"
    },
    {
      "utt_index": 10,
      "pred_speaker_id": "MOT"
    },
    {
      "utt_index": 11,
      "pred_speaker_id": "MOT"
    },
    {
      "utt_index": 12,
      "pred_speaker_id": "MOT"
    },
    {
      "utt_index": 13,
      "pred_speaker_id": "FAT"
    },
    {
      "utt_index": 14,
      "pred_speaker_id": "FAT"
    },
    {
      "utt_index": 15,
      "pred_speaker_id": "MOT"
    },
    {
      "utt_index": 16,
      "pred_speaker_id": "MOT"
    },
    {
      "utt_index": 17,
      "pred_speaker_id": "FAT"
    },
    {
      "utt_index": 18,
      "pred_speaker_id": "MOT"
    },
    {
      "utt_index": 19,
      "pred_speaker_id": "FAT"
    },
    {
      "utt_index": 20,
      "pred_speaker_id": "MOT"
    },
    {
      "utt_index": 21,
      "pred_speaker_id": "FAT"
    },
    {
      "utt_index": 22,
      "pred_speaker_id": "MOT"
    },
    {
      "utt_index": 23,
      "pred_speaker_id": "MOT"
    },
    {
      "utt_index": 24,
      "pred_speaker_id": "FAT"
    },
    {
      "utt_index": 25,
      "pred_speaker_id": "MOT"
    },
    {
      "utt_index": 26,
      "pred_speaker_id": "FAT"
    },
    {
      "utt_index": 27,
      "pred_speaker_id": "MOT"
    },
    {
      "utt_index": 28,
      "pred_speaker_id": "MOT"
    },
    {
      "utt_index": 29,
      "pred_speaker_id": "MOT"
    },
    {
      "utt_index": 30,
      "pred_speaker_id": "FAT"
    },
    {
      "utt_index": 31,
      "pred_speaker_id": "MOT"
    },
    {
      "utt_index": 32,
      "pred_speaker_id": "CHI"
    },
    {
      "utt_index": 33,
      "pred_speaker_id": "MOT"
    },
    {
      "utt_index": 34,
      "pred_speaker_id": "MOT"
    },
    {
      "utt_index": 35,
      "pred_speaker_id": "MOT"
    },
    {
      "utt_index": 36,
      "pred_speaker_id": "MOT"
    },
    {
      "utt_index": 37,
      "pred_speaker_id": "MOT"
    },
    {
      "utt_index": 38,
      "pred_speaker_id": "MOT"
    },
    {
      "utt_index": 39,
      "pred_speaker_id": "MOT"
    }
  ],
  "utterance_event_counts": [
    {
      "utt_index": 0,
      "pred_speaker_id": "FAT",
      "repetition_count": 0,
      "repair_count": 0,
      "pause_count": 0,
      "non_speech_count": 0,
      "overlap_count": 0,
      "total_event_count": 0
    },
    {
      "utt_index": 1,
      "pred_speaker_id": "MOT",
      "repetition_count": 0,
      "repair_count": 0,
      "pause_count": 1,
      "non_speech_count": 0,
      "overlap_count": 0,
      "total_event_count": 1
    },
    {
      "utt_index": 2,
      "pred_speaker_id": "FAT",
      "repetition_count": 0,
      "repair_count": 0,
      "pause_count": 0,
      "non_speech_count": 0,
      "overlap_count": 0,
      "total_event_count": 0
    },
    {
      "utt_index": 3,
      "pred_speaker_id": "MOT",
      "repetition_count": 0,
      "repair_count": 0,
      "pause_count": 0,
      "non_speech_count": 0,
      "overlap_count": 0,
      "total_event_count": 0
    },
    {
      "utt_index": 4,
      "pred_speaker_id": "MOT",
      "repetition_count": 0,
      "repair_count": 0,
      "pause_count": 0,
      "non_speech_count": 0,
      "overlap_count": 0,
      "total_event_count": 0
    },
    {
      "utt_index": 5,
      "pred_speaker_id": "MOT",
      "repetition_count": 0,
      "repair_count": 0,
      "pause_count": 0,
      "non_speech_count": 1,
      "overlap_count": 0,
      "total_event_count": 1
    },
    {
      "utt_index": 6,
      "pred_speaker_id": "MOT",
      "repetition_count": 1,
      "repair_count": 0,
      "pause_count": 0,
      "non_speech_count": 0,
      "overlap_count": 0,
      "total_event_count": 1
    },
    {
      "utt_index": 7,
      "pred_speaker_id": "MOT",
      "repetition_count": 1,
      "repair_count": 0,
      "pause_count": 0,
      "non_speech_count": 0,
      "overlap_count": 0,
      "total_event_count": 1
    },
    {
      "utt_index": 8,
      "pred_speaker_id": "MOT",
      "repetition_count": 0,
      "repair_count": 0,
      "pause_count": 0,
      "non_speech_count": 0,
      "overlap_count": 0,
      "total_event_count": 0
    },
    {
      "utt_index": 9,
      "pred_speaker_id": "MOT",
      "repetition_count": 0,
      "repair_count": 0,
      "pause_count": 0,
      "non_speech_count": 0,
      "overlap_count": 0,
      "total_event_count": 0
    },
    {
      "utt_index": 10,
      "pred_speaker_id": "MOT",
      "repetition_count": 0,
      "repair_count": 0,
      "pause_count": 0,
      "non_speech_count": 0,
      "overlap_count": 0,
      "total_event_count": 0
    },
    {
      "utt_index": 11,
      "pred_speaker_id": "MOT",
      "repetition_count": 0,
      "repair_count": 0,
      "pause_count": 0,
      "non_speech_count": 0,
      "overlap_count": 0,
      "total_event_count": 0
    },
    {
      "utt_index": 12,
      "pred_speaker_id": "MOT",
      "repetition_count": 1,
      "repair_count": 0,
      "pause_count": 0,
      "non_speech_count": 1,
      "overlap_count": 0,
      "total_event_count": 2
    },
    {
      "utt_index": 13,
      "pred_speaker_id": "FAT",
      "repetition_count": 0,
      "repair_count": 0,
      "pause_count": 0,
      "non_speech_count": 0,
      "overlap_count": 1,
      "total_event_count": 1
    },
    {
      "utt_index": 14,
      "pred_speaker_id": "FAT",
      "repetition_count": 0,
      "repair_count": 0,
      "pause_count": 0,
      "non_speech_count": 1,
      "overlap_count": 0,
      "total_event_count": 1
    },
    {
      "utt_index": 15,
      "pred_speaker_id": "MOT",
      "repetition_count": 0,
      "repair_count": 1,
      "pause_count": 0,
      "non_speech_count": 1,
      "overlap_count": 1,
      "total_event_count": 3
    },
    {
      "utt_index": 16,
      "pred_speaker_id": "MOT",
      "repetition_count": 0,
      "repair_count": 0,
      "pause_count": 0,
      "non_speech_count": 0,
      "overlap_count": 0,
      "total_event_count": 0
    },
    {
      "utt_index": 17,
      "pred_speaker_id": "FAT",
      "repetition_count": 0,
      "repair_count": 0,
      "pause_count": 0,
      "non_speech_count": 0,
      "overlap_count": 0,
      "total_event_count": 0
    },
    {
      "utt_index": 18,
      "pred_speaker_id": "MOT",
      "repetition_count": 1,
      "repair_count": 0,
      "pause_count": 0,
      "non_speech_count": 0,
      "overlap_count": 0,
      "total_event_count": 1
    },
    {
      "utt_index": 19,
      "pred_speaker_id": "FAT",
      "repetition_count": 0,
      "repair_count": 0,
      "pause_count": 0,
      "non_speech_count": 0,
      "overlap_count": 0,
      "total_event_count": 0
    },
    {
      "utt_index": 20,
      "pred_speaker_id": "MOT",
      "repetition_count": 0,
      "repair_count": 0,
      "pause_count": 0,
      "non_speech_count": 1,
      "overlap_count": 0,
      "total_event_count": 1
    },
    {
      "utt_index": 21,
      "pred_speaker_id": "FAT",
      "repetition_count": 0,
      "repair_count": 0,
      "pause_count": 0,
      "non_speech_count": 0,
      "overlap_count": 0,
      "total_event_count": 0
    },
    {
      "utt_index": 22,
      "pred_speaker_id": "MOT",
      "repetition_count": 0,
      "repair_count": 0,
      "pause_count": 0,
      "non_speech_count": 0,
      "overlap_count": 0,
      "total_event_count": 0
    },
    {
      "utt_index": 23,
      "pred_speaker_id": "MOT",
      "repetition_count": 0,
      "repair_count": 0,
      "pause_count": 0,
      "non_speech_count": 0,
      "overlap_count": 0,
      "total_event_count": 0
    },
    {
      "utt_index": 24,
      "pred_speaker_id": "FAT",
      "repetition_count": 0,
      "repair_count": 1,
      "pause_count": 0,
      "non_speech_count": 0,
      "overlap_count": 0,
      "total_event_count": 1
    },
    {
      "utt_index": 25,
      "pred_speaker_id": "MOT",
      "repetition_count": 0,
      "repair_count": 0,
      "pause_count": 0,
      "non_speech_count": 0,
      "overlap_count": 0,
      "total_event_count": 0
    },
    {
      "utt_index": 26,
      "pred_speaker_id": "FAT",
      "repetition_count": 0,
      "repair_count": 0,
      "pause_count": 0,
      "non_speech_count": 0,
      "overlap_count": 0,
      "total_event_count": 0
    },
    {
      "utt_index": 27,
      "pred_speaker_id": "MOT",
      "repetition_count": 1,
      "repair_count": 1,
      "pause_count": 0,
      "non_speech_count": 0,
      "overlap_count": 0,
      "total_event_count": 2
    },
    {
      "utt_index": 28,
      "pred_speaker_id": "MOT",
      "repetition_count": 1,
      "repair_count": 0,
      "pause_count": 0,
      "non_speech_count": 0,
      "overlap_count": 0,
      "total_event_count": 1
    },
    {
      "utt_index": 29,
      "pred_speaker_id": "MOT",
      "repetition_count": 1,
      "repair_count": 0,
      "pause_count": 0,
      "non_speech_count": 0,
      "overlap_count": 0,
      "total_event_count": 1
    },
    {
      "utt_index": 30,
      "pred_speaker_id": "FAT",
      "repetition_count": 0,